Pergunta,Opção 1,Opção 2,Opção 3,Opção 4,Resposta Correta
Em que ano o Brasil proclamou sua independência de Portugal?,1808,1822,1889,1500,2
Quem foi o líder da Alemanha durante a Segunda Guerra Mundial?,Josef Stalin,Benito Mussolini,Adolf Hitler,Winston Churchill,3
Qual civilização construiu as pirâmides de Gizé?,Grega,Romana,Egípcia,Mesopotâmica,3
O que marcou o fim da Idade Média?,A Revolução Francesa,A Queda do Império Romano,A Invenção da Imprensa,A Queda de Constantinopla,4
Quem foi o primeiro presidente do Brasil?,Getúlio Vargas,Deodoro da Fonseca,Juscelino Kubitschek,Dom Pedro II,2